{"binding_sha256":"4078593b29238c38baafa7e8604bd21f544d59281d8f64a0b3d4844536bf9910","build_result":{"CLOSURE_STATUS":"INCOMPLETE","FILES_STATUS":"HASHED","binding_sha256":"4078593b29238c38baafa7e8604bd21f544d59281d8f64a0b3d4844536bf9910","blockers":[{"code":"CLOSURE_INCOMPLETE","kind":"backend","logical_name":""},{"code":"CLOSURE_INCOMPLETE","kind":"engine","logical_name":""},{"code":"CLOSURE_INCOMPLETE","kind":"resources","logical_name":""},{"code":"PATH_SEMANTICS_UNRESOLVED","kind":"backend","logical_name":""},{"code":"PATH_SEMANTICS_UNRESOLVED","kind":"engine","logical_name":""},{"code":"PATH_SEMANTICS_UNRESOLVED","kind":"resources","logical_name":""}],"diagnostic_identity":{"label":"partial / non-reusable","value":{"domain":"IDENTITY_LOCK/v0","groups":[{"closure_policy":{"path_semantics":"UNRESOLVED","policy_id":"windows-bambu-02080261-runner020-bounded-v0.1","sha256":"0e723c91813e0c126f43852bf8bf25faf358d66e42e032fa10c4792b520e8af3","status":"INCOMPLETE","unresolved":["Exact loaded Windows CRT/API-set/system DLL identities and search configuration","Transitive/dynamic BambuStudio.dll dependency set including remaining static import candidates","Exact resource/default/template inheritance and fallback selection with explicit flat profiles","Effective datadir/user config discovery for configured route; current run/job binding not independently established","Actual WindowsApps Python runtime/stdlib/native-extension/import closure","Closed effective inherited environment and safe semantic-secret policy","Path/basename/cwd/TEMP/output relocation semantics for exact installed engine"],"version":"0.1"},"identity_kind":"backend","manifest":{"entries":[{"logical_name":"job.py","role":"execution_source","sha256":"5526026f2bb7ab28b109e9dad6b1cd753d51e07b5b78fbf76a3d836a9c2c66cb","size":"25419"},{"logical_name":"progress.py","role":"execution_source","sha256":"0cbb84245e6b3252b14838bda1cd1f89f93c98b4b39016e08cdd78f8c3362622","size":"3856"},{"logical_name":"runner.py","role":"execution_source","sha256":"405df011733de4cf469305a29c8609e1aa468202716c05d3cdb905435d3fde28","size":"26496"}],"schema_version":"0.1"},"metadata":{}},{"closure_policy":{"path_semantics":"UNRESOLVED","policy_id":"windows-bambu-02080261-runner020-bounded-v0.1","sha256":"0e723c91813e0c126f43852bf8bf25faf358d66e42e032fa10c4792b520e8af3","status":"INCOMPLETE","unresolved":["Exact loaded Windows CRT/API-set/system DLL identities and search configuration","Transitive/dynamic BambuStudio.dll dependency set including remaining static import candidates","Exact resource/default/template inheritance and fallback selection with explicit flat profiles","Effective datadir/user config discovery for configured route; current run/job binding not independently established","Actual WindowsApps Python runtime/stdlib/native-extension/import closure","Closed effective inherited environment and safe semantic-secret policy","Path/basename/cwd/TEMP/output relocation semantics for exact installed engine"],"version":"0.1"},"identity_kind":"engine","manifest":{"entries":[{"logical_name":"bambu-studio.exe","role":"executable","sha256":"7680dac4a953cb4f8a96cc2b4ad4ea0b8bfc62f937d3491256922ff24dbb8268","size":"159776"}],"schema_version":"0.1"},"metadata":{"declared_version":"02.08.02.61","platform_abi":"Windows-PE32+-AMD64"}},{"closure_policy":{"path_semantics":"UNRESOLVED","policy_id":"windows-bambu-02080261-runner020-bounded-v0.1","sha256":"0e723c91813e0c126f43852bf8bf25faf358d66e42e032fa10c4792b520e8af3","status":"INCOMPLETE","unresolved":["Exact loaded Windows CRT/API-set/system DLL identities and search configuration","Transitive/dynamic BambuStudio.dll dependency set including remaining static import candidates","Exact resource/default/template inheritance and fallback selection with explicit flat profiles","Effective datadir/user config discovery for configured route; current run/job binding not independently established","Actual WindowsApps Python runtime/stdlib/native-extension/import closure","Closed effective inherited environment and safe semantic-secret policy","Path/basename/cwd/TEMP/output relocation semantics for exact installed engine"],"version":"0.1"},"identity_kind":"resources","manifest":{"entries":[{"logical_name":"resources/profiles/BBL/cli_config.json","role":"cli_machine_limits","sha256":"89171aefd3ce218b8f2ca2e813a9b2991d1c715658f564a4e47a7b579f9255b1","size":"38685"},{"logical_name":"resources/profiles/BBL/machine/Bambu Lab A1 0.4 nozzle.json","role":"default_candidate","sha256":"645d5038a9b8084e2d30526f81a685e2dacf71ff48703014380125eb646c4d15","size":"2297"},{"logical_name":"resources/profiles/BBL/machine/fdm_bbl_3dp_001_common.json","role":"inheritance_candidate","sha256":"aa5b0148c3131965ab2bb1d377b43301304030c3d87b339897cef98809a9004f","size":"9633"},{"logical_name":"runtime/BambuStudio.dll","role":"bundled_runtime","sha256":"b480fae45d6e6337bb531f74b8e90b4f4470bef623e1a33e81c03c43f621e768","size":"108991008"},{"logical_name":"runtime/libgmp-10.dll","role":"static_math_runtime_candidate","sha256":"fec43cb18ce0ec8a5dd6ad1db745747167310ccb92b5acff0d445a8b3013f009","size":"543027"},{"logical_name":"runtime/libmpfr-4.dll","role":"static_math_runtime_candidate","sha256":"09b3b868b96433991fc15c9c5ae6f9a44c62d2e21194110442607917391ed927","size":"436011"}],"schema_version":"0.1"},"metadata":{}}],"schema_version":"0.1"}},"files":[{"after":{"ctime_ns":1787238836000000000,"device":133144642137240000,"inode":2251799813687966,"mtime_ns":1787238836000000000,"size":159776},"before":{"ctime_ns":1787238836000000000,"device":133144642137240000,"inode":2251799813687966,"mtime_ns":1787238836000000000,"size":159776},"expected_sha256":"7680dac4a953cb4f8a96cc2b4ad4ea0b8bfc62f937d3491256922ff24dbb8268","handle_after":{"ctime_ns":1788056265341944200,"device":133144642137240000,"inode":2251799813687966,"mtime_ns":1787238836000000000,"size":159776},"handle_before":{"ctime_ns":1788056265341944200,"device":133144642137240000,"inode":2251799813687966,"mtime_ns":1787238836000000000,"size":159776},"identity_kind":"engine","logical_name":"bambu-studio.exe","observed_bytes":159776,"required":true,"resolved_path":"J:\\Program Files\\Bambu Studio\\bambu-studio.exe","role":"executable","sha256":"7680dac4a953cb4f8a96cc2b4ad4ea0b8bfc62f937d3491256922ff24dbb8268","source_path":"J:\\Program Files\\Bambu Studio\\bambu-studio.exe","status":"HASHED"},{"after":{"ctime_ns":1787238830000000000,"device":133144642137240000,"inode":1970324836977280,"mtime_ns":1787238830000000000,"size":108991008},"before":{"ctime_ns":1787238830000000000,"device":133144642137240000,"inode":1970324836977280,"mtime_ns":1787238830000000000,"size":108991008},"expected_sha256":null,"handle_after":{"ctime_ns":1788056263727336700,"device":133144642137240000,"inode":1970324836977280,"mtime_ns":1787238830000000000,"size":108991008},"handle_before":{"ctime_ns":1788056263727336700,"device":133144642137240000,"inode":1970324836977280,"mtime_ns":1787238830000000000,"size":108991008},"identity_kind":"resources","logical_name":"runtime/BambuStudio.dll","observed_bytes":108991008,"required":true,"resolved_path":"J:\\Program Files\\Bambu Studio\\BambuStudio.dll","role":"bundled_runtime","sha256":"b480fae45d6e6337bb531f74b8e90b4f4470bef623e1a33e81c03c43f621e768","source_path":"J:\\Program Files\\Bambu Studio\\BambuStudio.dll","status":"HASHED"},{"after":{"ctime_ns":1787238830000000000,"device":133144642137240000,"inode":1970324836977314,"mtime_ns":1787238830000000000,"size":543027},"before":{"ctime_ns":1787238830000000000,"device":133144642137240000,"inode":1970324836977314,"mtime_ns":1787238830000000000,"size":543027},"expected_sha256":null,"handle_after":{"ctime_ns":1788056265412738100,"device":133144642137240000,"inode":1970324836977314,"mtime_ns":1787238830000000000,"size":543027},"handle_before":{"ctime_ns":1788056265412738100,"device":133144642137240000,"inode":1970324836977314,"mtime_ns":1787238830000000000,"size":543027},"identity_kind":"resources","logical_name":"runtime/libgmp-10.dll","observed_bytes":543027,"required":true,"resolved_path":"J:\\Program Files\\Bambu Studio\\libgmp-10.dll","role":"static_math_runtime_candidate","sha256":"fec43cb18ce0ec8a5dd6ad1db745747167310ccb92b5acff0d445a8b3013f009","source_path":"J:\\Program Files\\Bambu Studio\\libgmp-10.dll","status":"HASHED"},{"after":{"ctime_ns":1787238830000000000,"device":133144642137240000,"inode":1970324836977317,"mtime_ns":1787238830000000000,"size":436011},"before":{"ctime_ns":1787238830000000000,"device":133144642137240000,"inode":1970324836977317,"mtime_ns":1787238830000000000,"size":436011},"expected_sha256":null,"handle_after":{"ctime_ns":1788056265439745200,"device":133144642137240000,"inode":1970324836977317,"mtime_ns":1787238830000000000,"size":436011},"handle_before":{"ctime_ns":1788056265439745200,"device":133144642137240000,"inode":1970324836977317,"mtime_ns":1787238830000000000,"size":436011},"identity_kind":"resources","logical_name":"runtime/libmpfr-4.dll","observed_bytes":436011,"required":true,"resolved_path":"J:\\Program Files\\Bambu Studio\\libmpfr-4.dll","role":"static_math_runtime_candidate","sha256":"09b3b868b96433991fc15c9c5ae6f9a44c62d2e21194110442607917391ed927","source_path":"J:\\Program Files\\Bambu Studio\\libmpfr-4.dll","status":"HASHED"},{"after":{"ctime_ns":1787237884000000000,"device":133144642137240000,"inode":1688849860268039,"mtime_ns":1787237884000000000,"size":38685},"before":{"ctime_ns":1787237884000000000,"device":133144642137240000,"inode":1688849860268039,"mtime_ns":1787237884000000000,"size":38685},"expected_sha256":null,"handle_after":{"ctime_ns":1788056290270582200,"device":133144642137240000,"inode":1688849860268039,"mtime_ns":1787237884000000000,"size":38685},"handle_before":{"ctime_ns":1788056290270582200,"device":133144642137240000,"inode":1688849860268039,"mtime_ns":1787237884000000000,"size":38685},"identity_kind":"resources","logical_name":"resources/profiles/BBL/cli_config.json","observed_bytes":38685,"requir